<?xml version="1.0" encoding="UTF-8"?>
<?xml-stylesheet type="text/css" href="style.css"?>
<!DOCTYPE Uhart SYSTEM "student.dtd">

<Uhart>

<student studid="JORD" Yr="sen" status="full-time" prefname="Jordan" email="jspector@hartford.edu" phone="5083616477" gpa="3.14" major="CS" minor="None" advisor="Carolyn Roseine" initialenrollmentdate="2020-11-12" graddate="2025-01-04">
    <names>
      <first>Jordan</first>
      <last>Spector</last>
    </names>
  </student>

<student studid="DARE" Yr="soph" status="part-time" prefname="Johnny" email="rururu@hartford.edu" phone="1219219212" gpa="1.9" major="Psychology" minor="Data Science" advisor="Jordan Spector" initialenrollmentdate="2020-11-12">
    <names>
      <first>Ruby</first>
      <last>Stein</last>
    </names>
  </student>

<student studid="RYAN" Yr="jun" status="full-time" prefname="REPLACE" email="rryan@hartford.edu" phone="112919212" gpa="3.5" major="Photography" minor="Psychology" advisor="Roy Venegas " initialenrollmentdate="2020-11-12">
    <names>
      <first>Ryan</first>
      <last>Levitan</last>
    </names>
  </student>

</Uhart>
